{
  "schemaVersion": 1,
  "date": "2026-09-23",
  "generatedAt": "2026-09-22T16:09:47.188Z",
  "timezone": "Asia/Shanghai",
  "summary": {
    "totalItems": 238,
    "platformCount": 6,
    "freshPlatformCount": 4,
    "partialPlatformCount": 2
  },
  "platforms": [
    {
      "id": "douyin",
      "name": "抖音",
      "status": "fresh",
      "sourceKind": "official",
      "sourceUrl": "https://www.douyin.com/aweme/v1/web/hot/search/list/?device_platform=webapp&aid=6383&channel=channel_pc_web",
      "note": "",
      "collectedAt": "2026-09-22T16:09:47.188Z",
      "collectedCount": 48,
      "items": [
        {
          "id": "douyin-2660446",
          "rank": 1,
          "title": "我国首批航天员已全部停航停训",
          "url": "https://www.douyin.com/search/%E6%88%91%E5%9B%BD%E9%A6%96%E6%89%B9%E8%88%AA%E5%A4%A9%E5%91%98%E5%B7%B2%E5%85%A8%E9%83%A8%E5%81%9C%E8%88%AA%E5%81%9C%E8%AE%AD",
          "hotValue": 12083383,
          "hotLabel": "",
          "category": "6000",
          "publishedAt": "2026-09-22T04:40:19.000Z"
        },
        {
          "id": "douyin-2661100",
          "rank": 2,
          "title": "张展硕1500米自由泳夺冠",
          "url": "https://www.douyin.com/search/%E5%BC%A0%E5%B1%95%E7%A1%951500%E7%B1%B3%E8%87%AA%E7%94%B1%E6%B3%B3%E5%A4%BA%E5%86%A0",
          "hotValue": 12021645,
          "hotLabel": "3",
          "category": "5000",
          "publishedAt": "2026-09-22T08:56:19.000Z"
        },
        {
          "id": "douyin-2661468",
          "rank": 3,
          "title": "前8月工业经济稳中有进",
          "url": "https://www.douyin.com/search/%E5%89%8D8%E6%9C%88%E5%B7%A5%E4%B8%9A%E7%BB%8F%E6%B5%8E%E7%A8%B3%E4%B8%AD%E6%9C%89%E8%BF%9B",
          "hotValue": 11866577,
          "hotLabel": "",
          "category": "3001",
          "publishedAt": "2026-09-22T12:10:51.000Z"
        },
        {
          "id": "douyin-2660639",
          "rank": 4,
          "title": "用条纹打开韩系穿搭",
          "url": "https://www.douyin.com/search/%E7%94%A8%E6%9D%A1%E7%BA%B9%E6%89%93%E5%BC%80%E9%9F%A9%E7%B3%BB%E7%A9%BF%E6%90%AD",
          "hotValue": 11327986,
          "hotLabel": "17",
          "category": "16000",
          "publishedAt": "2026-09-22T06:26:04.000Z"
        },
        {
          "id": "douyin-2660464",
          "rank": 5,
          "title": "和好友一起打开川西慢旅行",
          "url": "https://www.douyin.com/search/%E5%92%8C%E5%A5%BD%E5%8F%8B%E4%B8%80%E8%B5%B7%E6%89%93%E5%BC%80%E5%B7%9D%E8%A5%BF%E6%85%A2%E6%97%85%E8%A1%8C",
          "hotValue": 10735649,
          "hotLabel": "3",
          "category": "10000",
          "publishedAt": "2026-09-22T05:02:15.000Z"
        },
        {
          "id": "douyin-2660052",
          "rank": 6,
          "title": "中国女排亚运会三连冠",
          "url": "https://www.douyin.com/search/%E4%B8%AD%E5%9B%BD%E5%A5%B3%E6%8E%92%E4%BA%9A%E8%BF%90%E4%BC%9A%E4%B8%89%E8%BF%9E%E5%86%A0",
          "hotValue": 10541621,
          "hotLabel": "",
          "category": "5000",
          "publishedAt": "2026-09-21T23:30:14.000Z"
        },
        {
          "id": "douyin-2660389",
          "rank": 7,
          "title": "盛李豪王子菲破世界纪录夺冠",
          "url": "https://www.douyin.com/search/%E7%9B%9B%E6%9D%8E%E8%B1%AA%E7%8E%8B%E5%AD%90%E8%8F%B2%E7%A0%B4%E4%B8%96%E7%95%8C%E7%BA%AA%E5%BD%95%E5%A4%BA%E5%86%A0",
          "hotValue": 9419636,
          "hotLabel": "",
          "category": "5000",
          "publishedAt": "2026-09-22T03:44:24.000Z"
        },
        {
          "id": "douyin-2659428",
          "rank": 8,
          "title": "超长蛋挞爆火出圈",
          "url": "https://www.douyin.com/search/%E8%B6%85%E9%95%BF%E8%9B%8B%E6%8C%9E%E7%88%86%E7%81%AB%E5%87%BA%E5%9C%88",
          "hotValue": 9383903,
          "hotLabel": "",
          "category": "9000",
          "publishedAt": "2026-09-21T08:43:31.000Z"
        },
        {
          "id": "douyin-2661261",
          "rank": 9,
          "title": "中国队男子4×100米混接夺金",
          "url": "https://www.douyin.com/search/%E4%B8%AD%E5%9B%BD%E9%98%9F%E7%94%B7%E5%AD%904%C3%97100%E7%B1%B3%E6%B7%B7%E6%8E%A5%E5%A4%BA%E9%87%91",
          "hotValue": 9351111,
          "hotLabel": "",
          "category": "5000",
          "publishedAt": "2026-09-22T10:08:09.000Z"
        },
        {
          "id": "douyin-2661540",
          "rank": 10,
          "title": "一场10年2.57万家庭的团圆",
          "url": "https://www.douyin.com/search/%E4%B8%80%E5%9C%BA10%E5%B9%B42.57%E4%B8%87%E5%AE%B6%E5%BA%AD%E7%9A%84%E5%9B%A2%E5%9C%86",
          "hotValue": 9294568,
          "hotLabel": "1",
          "category": "20002",
          "publishedAt": "2026-09-22T12:57:11.000Z"
        },
        {
          "id": "douyin-2661590",
          "rank": 11,
          "title": "全网都在恭喜中国女排夺冠",
          "url": "https://www.douyin.com/search/%E5%85%A8%E7%BD%91%E9%83%BD%E5%9C%A8%E6%81%AD%E5%96%9C%E4%B8%AD%E5%9B%BD%E5%A5%B3%E6%8E%92%E5%A4%BA%E5%86%A0",
          "hotValue": 9276699,
          "hotLabel": "1",
          "category": "5000",
          "publishedAt": "2026-09-22T13:35:14.000Z"
        },
        {
          "id": "douyin-2658963",
          "rank": 12,
          "title": "中秋国庆调休和高速政策提醒",
          "url": "https://www.douyin.com/search/%E4%B8%AD%E7%A7%8B%E5%9B%BD%E5%BA%86%E8%B0%83%E4%BC%91%E5%92%8C%E9%AB%98%E9%80%9F%E6%94%BF%E7%AD%96%E6%8F%90%E9%86%92",
          "hotValue": 9205006,
          "hotLabel": "",
          "category": "4003",
          "publishedAt": "2026-09-21T04:31:47.000Z"
        },
        {
          "id": "douyin-2660313",
          "rank": 13,
          "title": "2026中国民营企业500强发布",
          "url": "https://www.douyin.com/search/2026%E4%B8%AD%E5%9B%BD%E6%B0%91%E8%90%A5%E4%BC%81%E4%B8%9A500%E5%BC%BA%E5%8F%91%E5%B8%83",
          "hotValue": 9169245,
          "hotLabel": "",
          "category": "7000",
          "publishedAt": "2026-09-22T02:44:03.000Z"
        },
        {
          "id": "douyin-2661644",
          "rank": 14,
          "title": "女排姑娘的庆祝动作是ok和胜利",
          "url": "https://www.douyin.com/search/%E5%A5%B3%E6%8E%92%E5%A7%91%E5%A8%98%E7%9A%84%E5%BA%86%E7%A5%9D%E5%8A%A8%E4%BD%9C%E6%98%AFok%E5%92%8C%E8%83%9C%E5%88%A9",
          "hotValue": 9168217,
          "hotLabel": "8",
          "category": "5000",
          "publishedAt": "2026-09-22T14:29:26.000Z"
        },
        {
          "id": "douyin-2660848",
          "rank": 15,
          "title": "吴晓军任甘肃省委书记",
          "url": "https://www.douyin.com/search/%E5%90%B4%E6%99%93%E5%86%9B%E4%BB%BB%E7%94%98%E8%82%83%E7%9C%81%E5%A7%94%E4%B9%A6%E8%AE%B0",
          "hotValue": 8916770,
          "hotLabel": "",
          "category": "3001",
          "publishedAt": "2026-09-22T07:25:12.000Z"
        },
        {
          "id": "douyin-2661242",
          "rank": 16,
          "title": "万物皆可闪身步",
          "url": "https://www.douyin.com/search/%E4%B8%87%E7%89%A9%E7%9A%86%E5%8F%AF%E9%97%AA%E8%BA%AB%E6%AD%A5",
          "hotValue": 8849942,
          "hotLabel": "9",
          "category": "1001",
          "publishedAt": "2026-09-22T09:57:05.000Z"
        },
        {
          "id": "douyin-2660714",
          "rank": 17,
          "title": "俄军凌晨大规模打击乌克兰",
          "url": "https://www.douyin.com/search/%E4%BF%84%E5%86%9B%E5%87%8C%E6%99%A8%E5%A4%A7%E8%A7%84%E6%A8%A1%E6%89%93%E5%87%BB%E4%B9%8C%E5%85%8B%E5%85%B0",
          "hotValue": 8835664,
          "hotLabel": "3",
          "category": "3002",
          "publishedAt": "2026-09-22T06:45:28.000Z"
        },
        {
          "id": "douyin-2660756",
          "rank": 18,
          "title": "一地一张中秋名片",
          "url": "https://www.douyin.com/search/%E4%B8%80%E5%9C%B0%E4%B8%80%E5%BC%A0%E4%B8%AD%E7%A7%8B%E5%90%8D%E7%89%87",
          "hotValue": 8734509,
          "hotLabel": "3",
          "category": "20002",
          "publishedAt": "2026-09-22T06:59:01.000Z"
        },
        {
          "id": "douyin-2661354",
          "rank": 19,
          "title": "一人一个旅行信息差",
          "url": "https://www.douyin.com/search/%E4%B8%80%E4%BA%BA%E4%B8%80%E4%B8%AA%E6%97%85%E8%A1%8C%E4%BF%A1%E6%81%AF%E5%B7%AE",
          "hotValue": 8609447,
          "hotLabel": "3",
          "category": "10000",
          "publishedAt": "2026-09-22T11:06:38.000Z"
        },
        {
          "id": "douyin-2660866",
          "rank": 20,
          "title": "胡昌升任西藏自治区党委书记",
          "url": "https://www.douyin.com/search/%E8%83%A1%E6%98%8C%E5%8D%87%E4%BB%BB%E8%A5%BF%E8%97%8F%E8%87%AA%E6%B2%BB%E5%8C%BA%E5%85%9A%E5%A7%94%E4%B9%A6%E8%AE%B0",
          "hotValue": 8474637,
          "hotLabel": "",
          "category": "3001",
          "publishedAt": "2026-09-22T07:30:00.000Z"
        },
        {
          "id": "douyin-2660536",
          "rank": 21,
          "title": "韩国演员朴信惠二胎产女",
          "url": "https://www.douyin.com/search/%E9%9F%A9%E5%9B%BD%E6%BC%94%E5%91%98%E6%9C%B4%E4%BF%A1%E6%83%A0%E4%BA%8C%E8%83%8E%E4%BA%A7%E5%A5%B3",
          "hotValue": 8338713,
          "hotLabel": "3",
          "category": "2012",
          "publishedAt": "2026-09-22T05:37:54.000Z"
        },
        {
          "id": "douyin-2659920",
          "rank": 22,
          "title": "无畏契约史上最大版本更新",
          "url": "https://www.douyin.com/search/%E6%97%A0%E7%95%8F%E5%A5%91%E7%BA%A6%E5%8F%B2%E4%B8%8A%E6%9C%80%E5%A4%A7%E7%89%88%E6%9C%AC%E6%9B%B4%E6%96%B0",
          "hotValue": 8148623,
          "hotLabel": "3",
          "category": "12000",
          "publishedAt": "2026-09-21T14:02:00.000Z"
        },
        {
          "id": "douyin-2660164",
          "rank": 23,
          "title": "广东的鱼灯把中秋氛围拉满了",
          "url": "https://www.douyin.com/search/%E5%B9%BF%E4%B8%9C%E7%9A%84%E9%B1%BC%E7%81%AF%E6%8A%8A%E4%B8%AD%E7%A7%8B%E6%B0%9B%E5%9B%B4%E6%8B%89%E6%BB%A1%E4%BA%86",
          "hotValue": 8040819,
          "hotLabel": "3",
          "category": "10000",
          "publishedAt": "2026-09-22T01:02:49.000Z"
        },
        {
          "id": "douyin-2661094",
          "rank": 24,
          "title": "长假穿搭听劝中",